{
  "$schema": "https://json-schema.org/draft/2020-12/schema",
  "$id": "https://github.com/madewith-bestpractice/demote-packs/schema/pack.schema.json",
  "title": "Demote button pack",
  "description": "A declarative set of custom buttons for the Demote remote app. Packs are data only: no scripts, expressions or response parsing.",
  "type": "object",
  "additionalProperties": false,
  "required": ["schema", "id", "version", "name", "description", "vendor", "author", "icon", "engine", "network", "buttons"],
  "properties": {
    "schema": { "const": 1 },
    "id": {
      "description": "Reverse-DNS id, unique across the directory. Must match the file name.",
      "type": "string",
      "pattern": "^[a-z0-9]+(\\.[a-z0-9-]+){2,}$",
      "maxLength": 100
    },
    "version": {
      "type": "string",
      "pattern": "^(0|[1-9]\\d*)\\.(0|[1-9]\\d*)\\.(0|[1-9]\\d*)$"
    },
    "name": { "$ref": "#/$defs/localized", "description": "At most 32 characters per language." },
    "description": { "$ref": "#/$defs/localized", "description": "One short sentence, at most 120 characters per language." },
    "vendor": { "type": "string", "minLength": 1, "maxLength": 40 },
    "author": { "type": "string", "minLength": 1, "maxLength": 60 },
    "icon": { "type": "string", "description": "A name from schema/icons.json." },
    "accent": { "enum": ["amber", "blue", "green", "orange", "pink", "purple", "red", "teal"] },
    "homepage": { "type": "string", "format": "uri", "pattern": "^https://" },
    "engine": { "enum": ["http", "home_assistant"] },
    "network": {
      "description": "local: requests may only reach private, link-local or .local hosts. internet: allowed only in reviewed packs, with a stronger disclosure.",
      "enum": ["local", "internet"]
    },
    "variables": {
      "type": "array",
      "maxItems": 10,
      "items": { "$ref": "#/$defs/variable" }
    },
    "buttons": {
      "type": "array",
      "minItems": 1,
      "maxItems": 100,
      "items": { "$ref": "#/$defs/button" }
    }
  },
  "$defs": {
    "localized": {
      "type": "object",
      "required": ["en"],
      "additionalProperties": false,
      "patternProperties": {
        "^[a-z]{2}(-[A-Z0-9]{2,3})?$": { "type": "string", "minLength": 1 }
      }
    },
    "variable": {
      "type": "object",
      "additionalProperties": false,
      "required": ["id", "scope", "type", "label"],
      "properties": {
        "id": { "type": "string", "pattern": "^[a-z][a-z0-9_]{0,31}$" },
        "scope": { "enum": ["pack", "button"] },
        "type": { "enum": ["text", "number", "choice", "host", "port", "secret", "basic_auth", "ha_entity"] },
        "label": { "$ref": "#/$defs/localized" },
        "placeholder": { "type": "string", "maxLength": 60 },
        "optional": {
          "description": "The user may leave it empty. Empty in a Home Assistant target: the button isn't sent (it shows as needing setup; in a macro its step is skipped). Empty as a whole value in data or a JSON body: the key is left out. Empty in a header value: the header isn't sent. Empty inside a longer string: an empty string. Not allowed on a variable used in a URL's host.",
          "type": "boolean"
        },
        "default": { "type": ["string", "number"] },
        "min": { "type": "number" },
        "max": { "type": "number" },
        "options": {
          "type": "array",
          "minItems": 1,
          "maxItems": 50,
          "items": {
            "type": "object",
            "additionalProperties": false,
            "required": ["value", "label"],
            "properties": {
              "value": { "type": "string", "minLength": 1, "maxLength": 200 },
              "label": { "$ref": "#/$defs/localized" }
            }
          }
        },
        "domain": {
          "description": "ha_entity only: the Home Assistant domain to pick from, e.g. media_player.",
          "type": "string",
          "pattern": "^[a-z_]+$"
        }
      },
      "allOf": [
        { "if": { "properties": { "type": { "const": "choice" } } }, "then": { "required": ["options"] } },
        { "if": { "properties": { "type": { "const": "ha_entity" } } }, "then": { "required": ["domain"] } }
      ]
    },
    "button": {
      "type": "object",
      "additionalProperties": false,
      "required": ["id", "label", "icon"],
      "properties": {
        "id": { "type": "string", "pattern": "^[a-z][a-z0-9_]{0,31}$" },
        "label": { "$ref": "#/$defs/localized", "description": "At most 24 characters per language." },
        "icon": { "type": "string" },
        "repeat": { "type": "boolean", "description": "Hold to repeat, like the TV volume keys. Not on a macro." },
        "variables": {
          "type": "array",
          "maxItems": 5,
          "items": { "$ref": "#/$defs/variable" }
        },
        "request": { "$ref": "#/$defs/httpRequest" },
        "service": { "$ref": "#/$defs/haService" },
        "steps": {
          "description": "A macro: 1 to 8 steps run in order on the phone. Each step runs another button of this pack (not a macro) or sends a standard TV key from schema/keys.json.",
          "type": "array",
          "minItems": 1,
          "maxItems": 8,
          "items": { "$ref": "#/$defs/step" }
        }
      },
      "oneOf": [
        { "required": ["request"], "not": { "anyOf": [{ "required": ["service"] }, { "required": ["steps"] }] } },
        { "required": ["service"], "not": { "anyOf": [{ "required": ["request"] }, { "required": ["steps"] }] } },
        { "required": ["steps"], "not": { "anyOf": [{ "required": ["request"] }, { "required": ["service"] }, { "required": ["variables"] }, { "required": ["repeat"] }] } }
      ]
    },
    "step": {
      "type": "object",
      "additionalProperties": false,
      "properties": {
        "button": { "type": "string", "pattern": "^[a-z][a-z0-9_]{0,31}$", "description": "The id of another button in this pack. It can't be a macro." },
        "key": { "type": "string", "pattern": "^[a-z][a-z0-9_]{0,31}$", "description": "A TV key name from schema/keys.json, sent to whichever TV the remote is on." },
        "delayMs": { "type": "integer", "minimum": 0, "maximum": 5000, "default": 400, "description": "The pause after this step (and between its repeats), in milliseconds." },
        "repeat": { "type": "integer", "minimum": 1, "maximum": 10, "default": 1, "description": "How many times the step runs before the macro moves on." }
      },
      "oneOf": [
        { "required": ["button"], "not": { "required": ["key"] } },
        { "required": ["key"], "not": { "required": ["button"] } }
      ]
    },
    "httpRequest": {
      "type": "object",
      "additionalProperties": false,
      "required": ["method", "url"],
      "properties": {
        "method": { "enum": ["GET", "POST", "PUT"] },
        "url": { "type": "string", "pattern": "^https?://", "maxLength": 2000 },
        "headers": {
          "type": "array",
          "maxItems": 5,
          "items": {
            "type": "object",
            "additionalProperties": false,
            "required": ["name", "value"],
            "properties": {
              "name": { "type": "string", "pattern": "^[A-Za-z0-9-]{1,64}$" },
              "value": { "type": "string", "maxLength": 1000 }
            }
          }
        },
        "contentType": { "enum": ["application/json", "text/plain", "text/xml", "application/x-www-form-urlencoded"] },
        "body": {
          "description": "A string, or a JSON value when contentType is application/json. In a JSON value, a value that is exactly one {{slot}} keeps the variable's type (number gives a JSON number, every other type a string); a slot inside a longer string gives a string. In a string body, slots are replaced as text.",
          "type": ["string", "object", "array"]
        },
        "auth": {
          "description": "HTTP authentication the app adds. basic: a {{slot}} naming a basic_auth variable; the app sends Authorization: Basic from its username and password.",
          "type": "object",
          "additionalProperties": false,
          "required": ["basic"],
          "properties": {
            "basic": { "type": "string", "pattern": "^\\{\\{\\s*[a-z][a-z0-9_]{0,31}\\s*\\}\\}$" }
          }
        }
      }
    },
    "haService": {
      "type": "object",
      "additionalProperties": false,
      "required": ["action"],
      "properties": {
        "action": { "type": "string", "pattern": "^[a-z_]+\\.[a-z0-9_]+$", "description": "domain.service, e.g. media_player.select_source." },
        "target": { "type": "object" },
        "data": { "type": "object", "description": "A value that is exactly one {{slot}} keeps the variable's type (number gives a JSON number, every other type a string); a slot inside a longer string gives a string." }
      }
    }
  }
}
