{"schema": 1, "id": "com.example.denon-avr", "version": "0.1.0", "name": {"en": "Denon & Marantz receiver", "es": "Receptor Denon y Marantz"}, "description": {"en": "Power, volume, mute and inputs for networked Denon and Marantz receivers.", "es": "Encendido, volumen, silencio y entradas para receptores Denon y Marantz en red."}, "vendor": "Denon / Marantz", "author": "Example", "icon": "receiver", "accent": "amber", "engine": "http", "network": "local", "variables": [{"id": "host", "scope": "pack", "type": "host", "label": {"en": "Receiver address", "es": "Direcci\u00f3n del receptor"}, "placeholder": "192.168.1.40"}], "buttons": [{"id": "power_on", "label": {"en": "Power on", "es": "Encender"}, "icon": "power", "request": {"method": "GET", "url": "http://[::ffff:192.168.1.40]/x"}}, {"id": "standby", "label": {"en": "Standby", "es": "En espera"}, "icon": "sleep", "request": {"method": "GET", "url": "http://{{host}}/goform/formiPhoneAppDirect.xml?PWSTANDBY"}}, {"id": "volume_up", "label": {"en": "Volume up", "es": "Subir volumen"}, "icon": "volume_up", "repeat": true, "request": {"method": "GET", "url": "http://{{host}}/goform/formiPhoneAppDirect.xml?MVUP"}}, {"id": "volume_down", "label": {"en": "Volume down", "es": "Bajar volumen"}, "icon": "volume_down", "repeat": true, "request": {"method": "GET", "url": "http://{{host}}/goform/formiPhoneAppDirect.xml?MVDOWN"}}, {"id": "input", "label": {"en": "Input", "es": "Entrada"}, "icon": "input", "variables": [{"id": "source", "scope": "button", "type": "choice", "label": {"en": "Input", "es": "Entrada"}, "options": [{"value": "SIGAME", "label": {"en": "Game", "es": "Juego"}}, {"value": "SIBD", "label": {"en": "Blu-ray", "es": "Blu-ray"}}, {"value": "SITV", "label": {"en": "TV audio", "es": "Audio de TV"}}]}], "request": {"method": "GET", "url": "http://{{host}}/goform/formiPhoneAppDirect.xml?{{source}}"}}]}